{
  "run_id": "2026-10-08-001",
  "goal": "Explorer la liste de tâches comme un nouvel utilisateur",
  "budgets": {
    "max_charters": 8,
    "max_steps_per_charter": 40,
    "max_duration_min": 10,
    "parallelism": 1
  },
  "read_only": false,
  "ended": "finished",
  "verdict": "failed",
  "assessment": "Un défaut de compteur, le reste conforme.",
  "charters": [
    {
      "index": 1,
      "title": "Ajout et compteur",
      "status": "passed",
      "summary": "…",
      "findings": 1
    }
  ],
  "findings": [
    {
      "title": "Le compteur ne se met pas à jour après ajout",
      "kind": "issue",
      "severity": 4,
      "expected": "« 1 item left » après ajout d'une tâche",
      "actual": "« 0 items left » reste affiché",
      "repro_steps": [
        "ouvrir /",
        "saisir « Lait » puis Entrée",
        "lire le compteur en pied de liste"
      ],
      "route": "/",
      "screenshot_path": ".qa/runs/2026-10-08-001/explore/charter-1/finding-1.png",
      "id": "F-001",
      "charter": 1
    }
  ]
}
